"","3.087","5","10"
"VecSim with NS thresh & no VW",34.4645431784178,42.455470812061,53.8966040162038
"Spearman with NS thresh & No VW",33.5799258164623,41.6569912688729,53.2407842065011
"Spearman with NS combo & No VW",33.5733822575872,41.6526039131069,53.2376924120498
"Spearman with NS thresh & VW",33.26043634382,41.3764229297611,53.0192059303736
"VecSim with NS thresh & VW",32.8218622032632,41.3284663818542,53.2772333645407
"VecSim with NS bnn & No VW",23.5845032194446,30.0112663625287,40.6901415154864
"Spearman with NS bnn & No VW",23.3934667586415,29.8552134248686,40.5541815193149
